{
  "id": "singer_ember",
  "revision": 1,
  "name": "Ember",
  "role": "lead",
  "register": "Warm alto",
  "character": "Smooth, intimate, lightly smoky",
  "phrasing": "Patient lines; a slow descending melisma on a sustained hook vowel",
  "vibrato": "Restrained, arriving late on held notes",
  "language": "English",
  "identity_status": "direction_only",
  "voice_ref": null
}
